product_name,price (INR),rating,URL,reviews,ASIN,Description,Manufacturer
Wildcraft Unisex Zip Closure Backpack (Green_Free Size),"1,019",4.4 out of 5 stars,https://www.amazon.in/Wildcraft-Music-Backpack-Green-11954/dp/B07N2SBX54/ref=sr_1_216_mod_primary_new?crid=2M096C61O4MLT&keywords=bags&qid=1697644703&sbo=RZvfv%2F%2FHxDF%2BO5021pAnSA%3D%3D&sprefix=ba%2Caps%2C283&sr=8-216,384, B07N2SBX54,The product will be an excellent pick for you. It ensures an easy maintenance., Wildcraft
"Amazon Brand – Eono Reusable Tote Bags, 100% Organic Cotton Shopping/Grocery Bag, Multi-Purpose Bag, Sturdy Canvas Bag With 15kgs Capacity, Single Pack (Good Vibes)",179,3.8 out of 5 stars,https://www.amazon.in/Amazon-Brand-Reusable-Eco-Friendly-Multi-Purpose/dp/B08TTMMGYT/ref=sr_1_217?crid=2M096C61O4MLT&keywords=bags&qid=1697644703&sprefix=ba%2Caps%2C283&sr=8-217,"1,232", B08TTMMGYT,Product Description," Srinivasa Textiles, Srinivasa Textiles"
"STRABO Defender Laptop Bag, Light weight & Water resistant - Color Olive 35L, Unisex Bag",999,4.5 out of 5 stars,https://www.amazon.in/sspa/click?ie=UTF8&spc=MTo3MzE1MTM4OTc0MTMzNjU1OjE2OTc2NDQ3MDM6c3BfbXRmOjMwMDAxNDkzMTQ4NDczMjo6MDo6&url=%2FSTRABO-Defender-Laptop-weight-resistant%2Fdp%2FB0C9H8W6K6%2Fref%3Dsr_1_219_sspa%3Fcrid%3D2M096C61O4MLT%26keywords%3Dbags%26qid%3D1697644703%26sprefix%3Dba%252Caps%252C283%26sr%3D8-219-spons%26sp_csd%3Dd2lkZ2V0TmFtZT1zcF9tdGY%26psc%3D1,25, B0C9H8W6K6,Product Description, STRABO BAGS AND ACCESSORIES LLP
URBAN TRIBE Airborne 30L Convertible Laptop Backpack for Men and Women | Laptop Bag 15.6 inch | Suitcase/Briefcase Style Backpack,"1,287",4.1 out of 5 stars,https://www.amazon.in/sspa/click?ie=UTF8&spc=MTo3MzE1MTM4OTc0MTMzNjU1OjE2OTc2NDQ3MDM6c3BfbXRmOjMwMDA3MTkxMjcwNDEzMjo6MDo6&url=%2FUrban-Tribe-Laptop-Backpack-Airborne%2Fdp%2FB01LZ6G3KZ%2Fref%3Dsr_1_220_sspa%3Fcrid%3D2M096C61O4MLT%26keywords%3Dbags%26qid%3D1697644703%26sprefix%3Dba%252Caps%252C283%26sr%3D8-220-spons%26sp_csd%3Dd2lkZ2V0TmFtZT1zcF9tdGY%26psc%3D1,198, B01LZ6G3KZ,"It's super-sized to take care of all your travel clothing, shoes, accessories and each separated by our smart interiors. What’s more, UT Airborne has a separate 360 degree protected laptop compartment. This makes sorting and retrieving stuff from your backpack a breeze, especially when you are racing against time at an airport! We've also thrown in a few extra pockets and surprises along the way.", Backpack International Pvt Ltd
Gear Parker 23L Water Resistant Anti Theft Laptop Bag/Backpack for Men/Women - Black,695,4.3 out of 5 stars,https://www.amazon.in/Gear-Executive-Anti-Theft-Backpack-BKPPKREXE0101/dp/B097KCMQKG/ref=sr_1_222?crid=2M096C61O4MLT&keywords=bags&qid=1697644703&sprefix=ba%2Caps%2C283&sr=8-222,492, B097KCMQKG,"Gear bags are designed for the quick commute as well for the long journey. These backpacks can be used as laptop bags, adventure bags and so on. Your favorite travel companion, the backpacks come with enough storage space to carry all your requirements."," Gear, Gear Merchandise Pvt Ltd, E/12 West Chowbaga Gulshan Colony, Kolkata-700100"
"Genie Fringe Laptop Backpack for Women, 3 compartments, Stylish and Trendy College Bags for Girls, Water Resistant and Lightweight Bags for Office and Travelling Purpose. 36 litres","1,124",4.3 out of 5 stars,https://www.amazon.in/Genie-compartments-Resistant-Lightweight-Travelling/dp/B097JJ64SH/ref=sr_1_226?crid=2M096C61O4MLT&keywords=bags&qid=1697644703&sprefix=ba%2Caps%2C283&sr=8-226,24, B097JJ64SH,"How do you describe a Perfect School Backpack? Spacious enough to carry all the books, yet Light Weight! Padded Laptop Sleeve to keep it secure and sound. Multiple Pockets to segregate all the items and keep it easily accessible. An Organizer to keep your each and every school supplies in an arranged manner. Side Pocket to keep the Water Bottle. Water Resistant exteriors to keep all your worries at bay and lastly, latest and trendy design to keep those ""Cute Bagpack"" compliment coming in! Yes. We have that Perfect Bag for you, in our Genie store. Bringing you a cute, stylish and trendy design, Genie Fringe School Bag."," Safari, Safari Industries Ltd 301/302, A-Wing, The Qube, M.V.Road, Marol, Andheri(East), Near international Airport Mumbai- 400059 +91-22-40381851/838"
"URBAN TRIBE Accelerator 30L Laptop Backpack for Men and Women | Laptop Bag 15.6 inch | Office Bag | Work, Business, Casual, College | Black","1,498",4.0 out of 5 stars,https://www.amazon.in/sspa/click?ie=UTF8&spc=MTo3MzE1MTM4OTc0MTMzNjU1OjE2OTc2NDQ3MDM6c3BfYnRmOjMwMDA3MTkxNTM1OTMzMjo6MDo6&url=%2FUrban-Tribe-Laptop-Backpack-Accelerator%2Fdp%2FB01M6WLGH0%2Fref%3Dsr_1_230_sspa%3Fcrid%3D2M096C61O4MLT%26keywords%3Dbags%26qid%3D1697644703%26sprefix%3Dba%252Caps%252C283%26sr%3D8-230-spons%26sp_csd%3Dd2lkZ2V0TmFtZT1zcF9idGY%26psc%3D1,564, B01M6WLGH0,"Product Description
Accelerator Black Laptop Backpack
ANTI-THEFT ZIPPERS

These are the little things that make such a huge difference. The little lock, well hidden inside the water bottle pocket helps frustrate the efforts of seasoned thieves, while making it very easy for you to operate. This little device has saved many Trinity owners great heartburn.
WATER RESISTANT LIGHTWEIGHT FABRIC

When it comes to the quality of our fabric, there is no cutting corners, no compromise. Delivering the best quality and durability is part of our DNA. The Polyeuterene coated fabric helps the bag remain stubbornly water resistant while remaining exceedingly lightweight.
RIDE READY BACKPACKS

Trendish design to rock the road and set eyeballs blazing. All our backpacks are cut to look great on your two wheeler and built tough to last the rough ride!"," BACKPACK INTERNATIONAL PVT LTD., Backpack International Pvt Ltd, Contact no +919769487901"
Half Moon Large 37L Laptop Bag Backpack for menं Women Boys and Girls Luggage Travel Bags with 17.3 inches Laptop Compartment & Rain Cover,689,3.9 out of 5 stars,https://www.amazon.in/sspa/click?ie=UTF8&spc=MToyMzQzMDYwNDM5NDAzNjU1OjE2OTc2NDQ3MDQ6c3BfYXRmX25leHQ6MjAwOTEwODkyNDY4OTg6OjA6Og&url=%2FHalf-Moon-Resistant-Backpack-Compartment%2Fdp%2FB0BJ32LQ6X%2Fref%3Dsr_1_226_sspa%3Fcrid%3D2M096C61O4MLT%26keywords%3Dbags%26qid%3D1697644704%26sprefix%3Dba%252Caps%252C283%26sr%3D8-226-spons%26sp_csd%3Dd2lkZ2V0TmFtZT1zcF9hdGZfbmV4dA%26psc%3D1,"3,853", B0BJ32LQ6X,"This backpack is lightweight water-resistant, capacity of approx 37 Ltr, has a soft and ventilated back panel, and is perfect for carrying all your necessities. Adjustable and breathable padded shoulder strap to meet different requirements for both men and women; made from highly rip and water-resistant polyester fabric, provide strengthen and long-lasting performance; roomy enough for your traveling requirements also having a Rain cover.", Amazing Bags
"DAHSHA Nylon Stylish Small 6 Multi-Pocket Zip Closure Sling Cross Body Travel Messenger One Side Shoulder Bag for Men & Women (Grey, 25 x 10 x 20 CM)",545,4.0 out of 5 stars,https://www.amazon.in/DAHSHA-Sling-Messenger-Bag-Grey/dp/B09CGDFNBV/ref=sr_1_227?crid=2M096C61O4MLT&keywords=bags&qid=1697644704&sprefix=ba%2Caps%2C283&sr=8-227,860, B09CGDFNBV,"Product Description
DAHSHA Stylish Nylon Small 6 Multi Pocket Sling Cross Body Travel Office Business Messenger one Side Shoulder Bag for Men & Women (25x9x21 CM, Grey)
Brand: DAHSHA
Color: Grey
Material: Nylon
Pockets : 6 Multi Pocket
Product type: Travel Office Messenger Sling Bag
Perfect messenger bag/shoulder bag/cross body bag/ hiking or travelling Bag
Freely adjustable shoulder strap, you can adjust it according to your height and comfort requirements.
The stitching on this product is nice and very strong.
Perfect Size Cross Body Bag with pockets:
Lightweight cross-body design Messenger Bag Dimensions – Length- 20cm ,Width - 10cm, Height - 25cm.
Liter Size : 4.7 Liter .
Belt length- 140cm. small capacity but perfectly fits up to 9"" Tablet and you can use it as a bag to put all your small Accessory.
Liter Size : 4 Liter .small capacity but perfectly fits up to 10"" Tablet and you can use it as a bag to put all your small Accessory.
Great for traveling, Office,College and sports.
Make yourself more stylish with smart sling bags from Fantasy.
6 Multiple Compartment:
Multiple Pockets Crossbody bag : A total of 7 pockets (3 front side Pocket, 1 Inner Side Pocket, 2 Main Pocket & 1 Back Pocket)
Compact yet spacious sling bag for men and women -for 10"" Tablet shoulder side grey sling bag. Room for a camera, tablet, wallet, keys, phone.
Ideal applications: outdoor travels, college, office, casual outing, outdoor sports (hiking, camping, climbing, running, cycling, bike riding), travel, trips or so on.
DEAL FOR EVERY PLACE:
Zipper Closure : Securely Store Your Valuable Things.
Made of Nylon Material with zipper.
Adjustable Cross body Shoulder Strap: Carry your cross body bag securely thanks to the fully adjustable strap. Wear it on your shoulder or across your body for added protection against pickpockets & purse snatchers.
Perfect For Travelling
It has enough pockets and capacity to organise your basic survival gear, as well as to conveniently carry the stuff you have to access regularly
Wash it with clean water in ordinary temperature.
Do Not wash it with hot water and alkaline detergent.
Pockets Sling Bag: FOR Tablet AND MOBILE PHONES ETC
Our sling bags provide style and maximize comfort without sacrificing quality.
The offered lightweight and fashionable messenger bag is an ideal choice for keeping and organizing your personal essentials like pens, wallet, cell phone, keys, notebook, currency, tablet.
DS-Cross body Sling Bag- Grey Travel Messenger Bag- small Sling Bag with Handle-Dark Grey Sling Bag Vertical Chain Patch Tanbrown Mini Cross Body SlingTravel Bag-NavyBlue
Size 21.5 X 6.5 x 16 Cm 24x8.8x21.5cm 22.5cm x 9.5cm x 22.5 cm 25.5 x7x20cm 21 x 6.5 x 23 cm
Color Grey Olive Dark Grey TanBrown Navy Blue", Amazing Bags
DZert Clasy Laptop Bag College Bag for Boys Girls 21 L Red Black,339,3.8 out of 5 stars,https://www.amazon.in/DZert-Polyester-Black-White-Backpack/dp/B07GXX2BP3/ref=sr_1_228?crid=2M096C61O4MLT&keywords=bags&qid=1697644704&sprefix=ba%2Caps%2C283&sr=8-228,"2,612", B07GXX2BP3,"Product Description
Capicity: 21 litres, weight: 0. 4kg, dimensions: 45cmx29cmx16cm
Outer material: polyester, inner material: polyester
Water repellent: yes,
laptop compartment: yes,
compartments: 2, one front pocket to hold essentials and a mesh stash pocket on one side to accommodate a drinking bottle and other accessories
Utility: office, college, school, camping, weekend trip, day trip
Dzert Casual Backpack
Pump up your style quotient a notch higher as you step out carrying this Dzert's Casual Backpack. It has a vibrant and stylish design, along with the added benefit of spacious interiors. Made from polyester, this backpack features a blue colour along with the brand name in front.
Spacious Compartments
The bag has spacious compartments for carrying your belongings separately. There are also external pockets for carrying a bottle and other essentials.
Adjustable padded shoulder straps
This backpack comes with padded shoulder straps which can be adjusted according to your size for a customized fit. Furthermore, the broad straps distribute the weight of the backpack evenly across your shoulders.
Separate bottle pocket
his trendy and stylish backpack from Pole Star comes with a bottle pocket which can comfortably accommodate your bottle in a secure manner. Stay active all day and travel comfortably with the help of this ergonomically designed stylish backpack.
Top Padded handle
This amazing travel buddy comes with an easy to use loop handle at the top. The top Padded handle provides a secure hold while you pick up or move the backpack.
Spacious zippered compartments
This casual backpack comes with two spacious zippered compartments which can accommodate your notebooks & Laptop and other essentials with ease. Store your umbrella, notebooks and water bottle in this spacious bag and move around comfortably all day. college to picnic, to a casual outing to camping and short trips, this bag can be your great companion everywhere. Pack your bags and ready, steady go."," Rushi Enterprise, Rushi Enterprise, Gujarat Amreli (INDIA)-365601 Mo- 7016045876"
"Half Moon Curiosity 35L Water Resistant 15.6"" Laptop Bag for Men/Backpack for Men, Black | Office Bag for Men/Office Bag for Women with Padded Laptop Compartment | Rain Cover & Slim Durable Backpack",689,3.8 out of 5 stars,https://www.amazon.in/Half-Moon-Curiosity-Backpack-Resistant/dp/B09S3ZK3N1/ref=sr_1_230?crid=2M096C61O4MLT&keywords=bags&qid=1697644704&sprefix=ba%2Caps%2C283&sr=8-230,199, B09S3ZK3N1,"Product Description
Half Moon Backpack - A Quality of Backpacks
We(Half Moon) are sellers and manufacturers of various types of Customized Bags. Our product array comprises Backpacks, Sports Bags, Duffel Bags, Drawstring Bags, etc. These bags accomplish the customer's specifications and requirements. We provide these bags in numerous colors, designs, shapes, shades, patterns, etc. Our bags are known for lightweight, easy carrying, versatile usage, and durable nature.
Features
DURABLE MATERIAL: Made with strong polyester fabric with heavy zippers. Serves the need of a professional office laptop bag, college bag, student backpack, school bag and is suitable for all, i.e. boys, girls, men and women.
COMFY & STURDY: Its padded, adjustable shoulder straps do not put pressure on the shoulders. Foamed padded top handle is easy on your palm and fingers.
INNER MATERIAL: The material used in the inner compartments is thin yet strong and durable so, be assured of its quality. Thin material is used inside to make it lightweight & comfortable in carrying and to protect it from wear & tear.
LOTS OF STORAGE SPACE & POCKETS: One separate Padded laptop compartment. Multiple compartments can store lots of stuff, that is too organised. It has an internal organiser which is small pockets inside the first compartment for pens, diary, phone etc.
OTHER FEATURES: Rain cover, Internal Organiser, Reflector logo, Two water bottle/umbrella pockets, Secret-pocket at bottom for Rain cover and other stuffs, High-Quality zippers, Bartacks on pressure points for extra strength, Ergonomic design, etc.
Casual Stylish Backpack
This trendy backpack comes with multiple pockets and compartments and is very spacious and can accommodate all your stuff and will still be left with more space. With all features like padded handle, padded laptop compartment, internal organiser, reflector logo, bottle pockets, rain/dust cover etc, there is nothing that this backpack does not offer.
Backpack for Every Needs
This MADE IN INDIA Product features 2 large zippered compartments, 2 water bottle /umbrella pockets, Rain cover, Padded Laptop Compartment with 360° Protection, Top padded Handle for comfort, Reflective Stickers & Brand Logo for safety while travelling at night. Its ergonomics comfortable design makes you forget the load you are carrying,
Space & Comfort
This laptop backpack comes with two spacious zippered compartments which can accommodate your notebooks and other essentials with ease. This casual bag has Wide, Padded and Adjustable shoulder straps and Padded Back for comfort in carrying heavy items. Stitched properly and Bartacks on every pressure point for extra durability.
Small Pockets
This backpack features an Internal Organiser that is small pockets inside the front compartment for holding pens, ID cards, etc. These pockets are very useful in organizing your small day-to-day items.
Rain / Dust Cover
This backpack includes a separate rain/dust cover which can be very handy. It keeps your valuables safe and secure from rain and dust and keeps the backpack neat and clean for a longer period of time.
Proudly Made in India
Half Moon is proud to be an Indian Brand. We understand the importance of Indian manufacturing and supply chains. It is the time when we revive local industries that's why this bag is Made in India by Indians using Indian materials.
Shipped Directly from Factory
Half Moon offers high quality bags at lowest prices. We offers bags directly from factory to the customer to provide the bag at lowest prices possible.
Half Moon Curiosity 35L Travel Laptop College School Backpack Half Moon 45L Hammer Laptop Travelling Backpack Half Moon 35 L 15.6 inch Waterproof Laptop Office School Bag Backpack Rain Cover Half Moon 35L Casual Waterproof Laptop Office School Backpack with Rain Cover Half Moon Large 37L Laptop College School Bag Backpack for Men & Women
Size & Dimensions 48 x 34 x 23 cm 54 x 36 x 25 cm 48 x 35 x 21 cm 48 x 35 x 21 cm 50 x 30 x 22 cm
Color Navy Blue Black Black Navy Blue Black & Orange
Capacity 35 Litres 45 Litres 35 Litres 35 Litres 37 Litres
Bar-tacks ✓ ✓ ✓ ✓ ✓
Rain Cover ✓ ✓ ✓ ✓ ✓
Country of Origin India India India India India", Half_Moon(Amazing Bags)
Aristrocrat Unisex Laptop Bag Grey,663,4.4 out of 5 stars,https://www.amazon.in/Aristocrat-Zeal-Unisex-Grey-Laptop/dp/B0B5YHC1W5/ref=sr_1_231?crid=2M096C61O4MLT&keywords=bags&qid=1697644704&sprefix=ba%2Caps%2C283&sr=8-231,36, B0B5YHC1W5,"Stylish, Secure feature packed Laptop backpack Spacious Compartment Laptop Compatible Front Quick Access Pocket Power Bank Pocket Padded Grab Handle Shoulder strap re-enforcement"," VIP Industries Ltd. DGP House, 5th Floor, 88C Old Prabhadevi Road, Mumbai 400025, VIP Industries Limited, DGP House, 88C, Old Prabhadevi Road, Prabhadevi, Mumbai 400025. India'."
Dyazo Water Resistant Camera Backpack with Extra Front Pocket Photographers Bag with Rain Cover Tripod Holder Compatible for Sony Nikon Canon Panasonic DSLR (Black & Orange),698,4.2 out of 5 stars,https://www.amazon.in/Dyazo-Resistant-Photographers-Compatible-Panasonic/dp/B0BWWD1QQQ/ref=sr_1_232?crid=2M096C61O4MLT&keywords=bags&qid=1697644704&sprefix=ba%2Caps%2C283&sr=8-232,733, B0BWWD1QQQ,". Get your camera on the go with this durable camera backpack. This bag has a grey interior for storing your equipment and possessions, and an adjustable dividers for organization. It also has a tripod holder and a water bottle pocket for hydration purposes."," Dyazo, Dyazo F 15 Ground floor okhala Industrial Area New Delhi 110048 Customer care 72700000727"
Wildcraft Unisex Zip Closure Backpack (Green_Free Size),"1,019",4.4 out of 5 stars,https://www.amazon.in/Wildcraft-Music-Backpack-Green-11954/dp/B07N2SBX54/ref=sr_1_234_mod_primary_new?crid=2M096C61O4MLT&keywords=bags&qid=1697644704&sbo=RZvfv%2F%2FHxDF%2BO5021pAnSA%3D%3D&sprefix=ba%2Caps%2C283&sr=8-234,384, B07N2SBX54,The product will be an excellent pick for you. It ensures an easy maintenance., Wildcraft
"STRABO Defender Laptop Bag, Light weight & Water resistant - Color Olive 35L, Unisex Bag",999,4.5 out of 5 stars,https://www.amazon.in/sspa/click?ie=UTF8&spc=MToyMzQzMDYwNDM5NDAzNjU1OjE2OTc2NDQ3MDQ6c3BfbXRmOjMwMDAxNDkzMTQ4NDczMjo6MDo6&url=%2FSTRABO-Defender-Laptop-weight-resistant%2Fdp%2FB0C9H8W6K6%2Fref%3Dsr_1_235_sspa%3Fcrid%3D2M096C61O4MLT%26keywords%3Dbags%26qid%3D1697644704%26sprefix%3Dba%252Caps%252C283%26sr%3D8-235-spons%26sp_csd%3Dd2lkZ2V0TmFtZT1zcF9tdGY%26psc%3D1,25, B0C9H8W6K6,Product Description, STRABO BAGS AND ACCESSORIES LLP
Gear Double Decker 31L Large Water Resistant Faux Leather Anti-Theft Laptop Bag/Backpack/Office Bag for Men/Women (Navy-Tan),985,3.6 out of 5 stars,https://www.amazon.in/Gear-DOUBLE-Resistant-Backpack-Navy-Tan/dp/B0BTJ2T26W/ref=sr_1_242?crid=2M096C61O4MLT&keywords=bags&qid=1697644704&sprefix=ba%2Caps%2C283&sr=8-242,47, B0BTJ2T26W,Each Gear Bag is born in our in-house design & prototyping studio & characterises a recognisable aesthetic & functionality," Gear Merchandise Pvt Ltd, Gear Merchandise Pvt Ltd, E/12 West Chowbaga, Gulshan Colony, Kolkata 700100"
ZaySoo Stylish Casual Laptop Backpack/Office Bag/College Bag/Business Bag/Travel Backpack - Navyblue,307,5.0 out of 5 stars,https://www.amazon.in/ZaySoo-Stylish-Backpack-College-Business/dp/B0BVZL49N8/ref=sr_1_243?crid=2M096C61O4MLT&keywords=bags&qid=1697644704&sprefix=ba%2Caps%2C283&sr=8-243,2, B0BVZL49N8,"🎒About The Product🎒 Choose a backpack that's the right size for your needs and has enough capacity to carry all your gear. Look for a backpack made from durable, water-resistant material that can withstand the elements. backpack should have padded shoulder straps, a hip belt, and a back panel that provide comfort and support during long hikes. Multiple pockets and compartments help you organize your gear and make it easy to access everything you need. If you plan to carry a laptop, look for a backpack with a padded laptop sleeve to protect your computer. Hydration system compatibility Some backpacks have built-in hydration systems or are compatible with hydration reservoirs. External attachment points Look for backpacks with external attachment points for carrying gear like trekking poles, ice axes, or sleeping bags. Compression straps These help to secure your load and prevent it from shifting around inside the backpack. 🎒Specification🎒 Outer material: Nylon Capacity: 35 liters approx Weight: 600 grams approx Dimensions: 33cms x 17cms x 43cms (LxWxH)approx Number of compartments: 2 Pocket Description: Utility Pocket Style Name: Traditional Backpacks Closure Type: Zipper Age Range Description: Adult Special Features: Back Padding , Zipper Lock System."," ZaySoo, ZaySoo"
Gear ECO1 24L Medium Water Resistant Laptop Bag/Backpack/Office Bag for Men/Women (Grey-Black-Yellow),759,4.1 out of 5 stars,https://www.amazon.in/Gear-Polyester-Laptop-Backpack-LBPECONO10412/dp/B012NW0J30/ref=sr_1_244?crid=2M096C61O4MLT&keywords=bags&qid=1697644704&sprefix=ba%2Caps%2C283&sr=8-244,"1,497", B012NW0J30,Three main compartments one front smaller compartment bottle holder mesh embedded organizer heavily padded sleeve which fits laptop padded grab handle.," Gear Merchandise PVT LTD, Gear Merchandise PVT LTD E/12 West Chowbaga Gulshan colony KoLkata-700100 Contact 9830403366"
TRAWOC Travel Backpack - 40 Litre Laptop Bag with Rain Cover & Shoe Compartment - Versatile Casual Bag - Ideal Backpack for Men and Women,"1,345",5.0 out of 5 stars,https://www.amazon.in/sspa/click?ie=UTF8&spc=MToyMzQzMDYwNDM5NDAzNjU1OjE2OTc2NDQ3MDQ6c3BfYnRmOjMwMDA2MzEzNzY3ODgzMjo6MDo6&url=%2FTRAWOC-Travel-Backpack-Compartment-Women-Olivegreen%2Fdp%2FB0CFFLCBKZ%2Fref%3Dsr_1_245_sspa%3Fcrid%3D2M096C61O4MLT%26keywords%3Dbags%26qid%3D1697644704%26sprefix%3Dba%252Caps%252C283%26sr%3D8-245-spons%26sp_csd%3Dd2lkZ2V0TmFtZT1zcF9idGY%26psc%3D1,2, B0CFFLHXHK,"Discover the perfect travel companion with the TRAWOC Travel Backpack. Designed for both men and women, this stylish backpack offers a generous 40 litre capacity, making it an ideal backpack for 2-3 days trip or a quick weekend getaway. It measures 59 cm x 33 cm x 20 cm, providing ample space for your essentials. This large backpack for men and women features one large main compartment for your clothes and a padded laptop sleeve suitable for a 15.6-inch laptop. The two zipper pockets provide additional storage for smaller items and documents. Meanwhile, both side water bottle pockets ensure you stay hydrated during your trip. Crafted from premium quality fabric, this backpack bag is designed to withstand the rigors of travel. The water-resistant fabric protects your belongings, while the integrated 100% waterproof rain cover, stored in a separate pocket, offers an extra layer of protection during inclement weather. Comfort is at the forefront of this backpack’s design. It boasts a breathable mesh padded back panel and fully adjustable shoulder straps, ensuring comfort during extended periods of wear. With its premium quality YKK zippers, buckles, and clips, you can trust that the TRAWOC Travel Backpack will stand the test of time. Plus, it comes with a 3-year manufacturer warranty for peace of mind. Whether you're using it as a laptop backpack for the office, a trekking hiking backpack for your next adventure, or a big size bag for a tourist tour, this backpack is versatile and durable. Experience the convenience and comfort of travelling with the TRAWOC Travel Backpack."," TRAWOC, TRAWOC Gears, Customer care"
URBAN TRIBE Airborne 30L Convertible Laptop Backpack for Men and Women | Laptop Bag 15.6 inch | Suitcase/Briefcase Style Backpack,"1,287",4.1 out of 5 stars,https://www.amazon.in/sspa/click?ie=UTF8&spc=MToyMzQzMDYwNDM5NDAzNjU1OjE2OTc2NDQ3MDQ6c3BfYnRmOjMwMDA3MTkxMjcwNDEzMjo6MDo6&url=%2FUrban-Tribe-Laptop-Backpack-Airborne%2Fdp%2FB01LZ6G3KZ%2Fref%3Dsr_1_246_sspa%3Fcrid%3D2M096C61O4MLT%26keywords%3Dbags%26qid%3D1697644704%26sprefix%3Dba%252Caps%252C283%26sr%3D8-246-spons%26sp_csd%3Dd2lkZ2V0TmFtZT1zcF9idGY%26psc%3D1,198, B01LZ6G3KZ,"It's super-sized to take care of all your travel clothing, shoes, accessories and each separated by our smart interiors. What’s more, UT Airborne has a separate 360 degree protected laptop compartment. This makes sorting and retrieving stuff from your backpack a breeze, especially when you are racing against time at an airport! We've also thrown in a few extra pockets and surprises along the way.", Backpack International Pvt Ltd
